{
  "id": "INT_20250920_00017",
  "version": "1.0",
  "lang": "ja",
  "task_family": "interval_scheduling",
  "answer_type": "int",
  "task": "interval_scheduling",
  "statement_ja": "開始時刻 s_i, 終了時刻 t_i の n 個の仕事から、互いに重ならない最大数を選べ。",
  "io_spec": {
    "input": "n\\n(s t)×n",
    "output": "選べる最大個数"
  },
  "instance": {
    "seed": 17,
    "template_id": "INT_T1",
    "params": {
      "n": 16
    }
  },
  "tests": [
    {
      "in": "16\n689 798\n662 785\n415 544\n769 810\n216 315\n691 835\n136 317\n232 352\n640 704\n412 439\n269 463\n643 776\n617 728\n424 452\n731 879\n770 877\n",
      "out": "4\n"
    },
    {
      "in": "16\n689 798\n662 785\n415 544\n769 810\n216 315\n691 835\n136 317\n232 352\n640 704\n412 439\n269 463\n643 776\n617 728\n424 452\n731 877\n770 877\n",
      "out": "4\n"
    }
  ],
  "reference": {
    "py": "ref/py/int_sched.py"
  },
  "hints": [
    {
      "level": 1,
      "text": "終了時刻が早い仕事から選ぶ貪欲法。"
    },
    {
      "level": 2,
      "text": "終了時刻で昇順ソートし、可能なら採用して終了時刻を更新。"
    },
    {
      "level": 3,
      "text": "同タイのとき開始が早い順でも最適性は保たれる。"
    }
  ],
  "distractors": [
    {
      "code": "TIE_BREAK_WRONG",
      "desc": "終了時刻同点の処理を誤る"
    },
    {
      "code": "END_EXCLUSIVE_CONFUSION",
      "desc": "重なり判定で >= と > を取り違え"
    },
    {
      "code": "LOWER_UPPER_SWAP",
      "desc": "開始・終了の大小を取り違え"
    }
  ],
  "witness": {
    "chosen_indices_t1": [
      4,
      9,
      8,
      3
    ],
    "chosen_indices_t2": [
      4,
      9,
      8,
      3
    ]
  },
  "difficulty": {
    "score": 0.35,
    "basis": "greedy with tie-break"
  },
  "tags": [
    "greedy",
    "simulation",
    "beginner"
  ],
  "license": "CC BY-SA 4.0 (texts) / MIT (code)"
}