{
  "id": "KNAP_20250920_00007",
  "version": "1.0",
  "lang": "ja",
  "task_family": "knapsack_01",
  "answer_type": "int",
  "task": "knapsack_01",
  "statement_ja": "重さ w_i と価値 v_i の品物から、容量 W を超えないように選んで価値合計を最大化せよ（各品物は高々1個）。",
  "io_spec": {
    "input": "n W\\n(w v)×n",
    "output": "最大価値（整数）"
  },
  "instance": {
    "seed": 7,
    "template_id": "KNAP_T1",
    "params": {
      "n": 8,
      "W": 56
    }
  },
  "tests": [
    {
      "in": "8 56\n12 31\n14 18\n14 65\n23 32\n4 74\n11 35\n28 88\n5 10\n",
      "out": "237\n"
    },
    {
      "in": "9 56\n12 31\n14 18\n14 65\n23 32\n4 74\n11 35\n28 88\n5 10\n33 170\n",
      "out": "319\n"
    }
  ],
  "reference": {
    "py": "ref/py/knap01.py"
  },
  "hints": [
    {
      "level": 1,
      "text": "0/1ナップサックは DP（容量方向）で解く。"
    },
    {
      "level": 2,
      "text": "dp[cap] を容量 cap の最大価値として、各品目を後ろ向きに更新。"
    },
    {
      "level": 3,
      "text": "復元は dp の差分から選択アイテムを逆順に辿る。"
    }
  ],
  "distractors": [
    {
      "code": "TAKE_MAX_VALUE_ONLY",
      "desc": "価値の大きい順に貪欲に取る誤り"
    },
    {
      "code": "WRONG_GREEDY_ORDER",
      "desc": "価値/重さ比のみの貪欲（0/1では最適保証なし）"
    },
    {
      "code": "OVERFLOW_EDGE_IGNORED",
      "desc": "容量境界の等号扱いを誤る"
    }
  ],
  "witness": {
    "opt_value_t1": 237,
    "chosen_items_t1": [
      2,
      4,
      6,
      7
    ],
    "opt_value_t2": 319,
    "chosen_items_t2": [
      2,
      4,
      7,
      8
    ]
  },
  "difficulty": {
    "score": 0.45,
    "basis": "O(nW) DP with reconstruction"
  },
  "tags": [
    "dp",
    "simulation",
    "intermediate"
  ],
  "license": "CC BY-SA 4.0 (texts) / MIT (code)"
}