{
  "id": "GCD_20250920_00015",
  "task": "gcd",
  "statement_ja": "整数 a, b が与えられる。a と b の最大公約数を求めよ。",
  "io_spec": {
    "input": "a b",
    "output": "gcd(a,b)"
  },
  "instance": {
    "seed": 15,
    "template_id": "GCD_T1",
    "params": {
      "a": 707319,
      "b": 947472
    }
  },
  "tests": [
    {
      "in": "707319 947472\n",
      "out": "3\n"
    },
    {
      "in": "947472 707319\n",
      "out": "3\n"
    }
  ],
  "reference": {
    "py": "ref/py/gcd.py"
  },
  "hints": [
    {
      "level": 1,
      "text": "ユークリッドの互除法を思い出そう。"
    },
    {
      "level": 2,
      "text": "gcd(a,b)=gcd(b, a mod b) をb=0まで繰り返す。"
    },
    {
      "level": 3,
      "text": "while b: a,b=b,a%b。最後のaが答え。"
    }
  ],
  "distractors": [
    {
      "code": "MOD_NEGATIVE",
      "desc": "負の剰余の扱いを誤る"
    }
  ],
  "witness": {
    "opt_value": 3
  },
  "difficulty": {
    "score": 0.2,
    "basis": "ループ回数が小さい"
  },
  "tags": [
    "number",
    "math",
    "beginner"
  ],
  "license": "CC BY-SA 4.0 (texts) / MIT (code)"
}