{
  "id": "MST_20250920_00006",
  "version": "1.0",
  "lang": "ja",
  "task_family": "mst_kruskal",
  "answer_type": "int",
  "task": "mst_kruskal",
  "statement_ja": "重み付き無向グラフの最小全域木の重み合計を求めよ。連結でない場合は -1。",
  "io_spec": {
    "input": "n m\\n(u v w)×m（1-indexed）",
    "output": "MST重み合計または -1"
  },
  "instance": {
    "seed": 6,
    "template_id": "MST_T1",
    "params": {
      "n": 48
    }
  },
  "tests": [
    {
      "in": "48 94\n10 34 834\n26 30 809\n33 45 234\n26 39 423\n23 25 873\n3 22 202\n1 15 710\n1 24 203\n8 39 460\n16 31 684\n3 24 755\n14 42 770\n27 36 590\n36 48 410\n8 41 428\n19 41 316\n2 34 972\n16 33 919\n2 43 687\n21 32 342\n9 21 169\n1 10 263\n27 29 940\n28 46 375\n8 43 599\n21 25 16\n4 18 610\n31 44 603\n5 46 702\n25 40 419\n15 41 467\n6 38 31\n3 30 405\n10 26 710\n16 21 326\n8 47 871\n10 44 832\n3 5 677\n6 22 789\n32 41 748\n12 17 426\n3 14 329\n12 26 634\n14 23 589\n4 31 522\n1 7 741\n2 6 985\n19 31 608\n11 27 925\n11 45 55\n20 23 120\n26 36 509\n29 35 862\n35 48 567\n12 37 689\n30 33 495\n8 42 319\n32 36 301\n24 32 969\n41 48 307\n5 6 732\n13 41 558\n4 26 41\n1 2 697\n1 11 955\n8 26 875\n3 39 656\n3 48 433\n4 28 409\n39 43 959\n1 4 847\n2 3 144\n8 19 256\n10 16 265\n1 13 902\n27 32 190\n2 12 472\n18 20 447\n13 36 741\n39 45 811\n22 38 396\n11 26 855\n9 38 498\n26 44 197\n8 23 887\n36 39 523\n6 7 339\n32 35 824\n7 24 375\n15 37 525\n5 8 376\n8 16 506\n14 47 66\n6 9 912\n",
      "out": "16442\n"
    },
    {
      "in": "48 94\n10 34 230\n26 30 357\n33 45 53\n26 39 51\n23 25 492\n3 22 254\n1 15 343\n1 24 3\n8 39 839\n16 31 54\n3 24 52\n14 42 13\n27 36 293\n36 48 53\n8 41 50\n19 41 466\n2 34 58\n16 33 731\n2 43 274\n21 32 546\n9 21 305\n1 10 896\n27 29 40\n28 46 852\n8 43 263\n21 25 60\n4 18 54\n31 44 60\n5 46 282\n25 40 646\n15 41 850\n6 38 665\n3 30 56\n10 26 435\n16 21 55\n8 47 608\n10 44 60\n3 5 956\n6 22 21\n32 41 59\n12 17 728\n3 14 709\n12 26 428\n14 23 666\n4 31 854\n1 7 53\n2 6 52\n19 31 55\n11 27 52\n11 45 290\n20 23 73\n26 36 60\n29 35 855\n35 48 54\n12 37 78\n30 33 887\n8 42 59\n32 36 52\n24 32 58\n41 48 179\n5 6 50\n13 41 62\n4 26 55\n1 2 692\n1 11 549\n8 26 295\n3 39 533\n3 48 51\n4 28 146\n39 43 310\n1 4 635\n2 3 52\n8 19 52\n10 16 67\n1 13 51\n27 32 58\n2 12 59\n18 20 163\n13 36 493\n39 45 462\n22 38 56\n11 26 683\n9 38 619\n26 44 847\n8 23 838\n36 39 54\n6 7 8\n32 35 11\n7 24 769\n15 37 53\n5 8 558\n8 16 218\n14 47 468\n6 9 54\n",
      "out": "4923\n"
    }
  ],
  "reference": {
    "py": "ref/py/mst_kruskal.py"
  },
  "hints": [
    {
      "level": 1,
      "text": "辺を重み昇順に並べ、サイクルを作らないものだけ採用（Kruskal）。"
    },
    {
      "level": 2,
      "text": "サイクル判定にUnion-Findを使う。採用数が n-1 に達したら終了。"
    },
    {
      "level": 3,
      "text": "重みが同じでも動くように比較は w のみ。"
    }
  ],
  "distractors": [
    {
      "code": "WRONG_SORT_KEY",
      "desc": "w以外でソート"
    },
    {
      "code": "CYCLE_FILTER_MISS",
      "desc": "サイクル検出を忘れる"
    },
    {
      "code": "UNION_ORDER_BUG",
      "desc": "併合の大小関係を誤る"
    }
  ],
  "witness": {
    "mst_weight_t1": 16442,
    "chosen_edges_t1": [
      25,
      31,
      62,
      49,
      92,
      50,
      71,
      20,
      75,
      83,
      5,
      7,
      2,
      72,
      21,
      73,
      57,
      59,
      15,
      56,
      34,
      41,
      86,
      19,
      88,
      23,
      90,
      80,
      32,
      68,
      13,
      29,
      3,
      40,
      77,
      8,
      30,
      76,
      55,
      44,
      89,
      61,
      53,
      43,
      24,
      0,
      52
    ],
    "mst_weight_t2": 4923,
    "chosen_edges_t2": [
      7,
      86,
      87,
      11,
      38,
      22,
      60,
      14,
      74,
      67,
      3,
      71,
      46,
      10,
      72,
      48,
      57,
      89,
      2,
      13,
      26,
      93,
      9,
      85,
      62,
      34,
      47,
      32,
      80,
      16,
      75,
      76,
      56,
      39,
      36,
      25,
      27,
      50,
      54,
      68,
      77,
      24,
      28,
      49,
      92,
      29,
      40
    ]
  },
  "difficulty": {
    "score": 0.45,
    "basis": "Kruskal + DSU"
  },
  "tags": [
    "graph",
    "mst",
    "dsu",
    "intermediate"
  ],
  "license": "CC BY-SA 4.0 (texts) / MIT (code)"
}